date,reviewer,usefulness_pct,overall_pct,category,severity,description
2026-03-20,alert-investigator,75,80,routine,low,No active alerts to investigate - all recent alerts acknowledged. System running smoothly.2026-03-20 11:10,alert-investigator,85,90,monitoring,info,"Clean alert investigation run - no unacknowledged alerts, system functioning normally. Multiple compression signals noted across assets suggesting volatility expansion setup."
2026-03-20 12:10,dev-agent,92,92,release,info,"Released v0.14.0 (84 commits since v0.13.0). Version bump, release changelog, tag pushed. TODO backlog empty — all P0/P1 issues resolved. 1495 tests pass, clippy clean. Release pipeline building for all platforms."
2026-03-20 12:11,alert-investigator,90,90,monitoring,info,"Clean alert investigation run - no unacknowledged alerts found, all previous alerts properly acknowledged. Alert system functioning normally with appropriate thresholds armed."
2026-03-20 13:10,alert-investigator,88,85,monitoring,info,Clean alert investigation run - no unacknowledged alerts found. All scan alerts from morning already acknowledged. System alert thresholds properly armed and monitoring. Agent messaging pipeline working correctly.
2026-03-20 14:11,alert-investigator,85,88,monitoring,info,"Clean alert investigation run - no unacknowledged alerts found. Iran war driving risk-off conditions, oil approaching $100 threshold. Gold institutional buying signal (12.2x volume) and multiple volatility compression setups noted. All alert thresholds armed and system functioning normally."
2026-03-20 15:10,alert-investigator,85,88,monitoring,info,"Clean alert investigation run - no unacknowledged alerts found. Risk-off regime with Iran war scenarios at 95%. Precious metals selling off hard (gold -9%, silver -10% weekly), crypto weak (ETH -3.35%, BTC -2.13%). System alert thresholds armed and functioning normally."
2026-03-20,morning-intelligence,75,80,enhancement,P2,pftui analytics excellent for regime detection and asset alignment. Evening analysis agent messages provided good context. Would benefit from better portfolio sync with actual holdings vs test portfolio shown.
2026-03-20 16:13,dev-agent,90,92,code-quality,low,"TODO backlog empty. Found and fixed sole remaining partial_cmp().unwrap() in production code (asset_detail_popup.rs ETF fund flow sort). NaN-safe now — matches pattern across 9 other sort_by sites. Codebase very clean: 1495 tests pass, clippy clean, no production unwrap() issues remaining."
2026-03-20 16:15,alert-investigator,90,88,monitoring,info,Clean alert investigation run - no unacknowledged alerts. Risk-off regime correctly identified with Iran/inflation scenarios at 95%. Portfolio tracking accurate (-1.90%). All alert thresholds armed and agent messaging pipeline functioning normally.
2026-03-20,low-timeframe-analyst,85,88,enhancement,P2,"pftui data sources comprehensive for midday analysis. All portfolio, alerts, sentiment, onchain data available. Minor enhancement: BTC price data showed anomalous 224632% daily change - needs validation/bounds checking"
2026-03-20,alert-investigator,85,80,scan_alerts,routine,Three scan alerts properly investigated - SMCI crash and risk-off shift well-identified with clear catalyst analysis
2026-03-20,alert-investigator,85,80,data-quality,low,Alert system functioning correctly. All scan alerts properly acknowledged. BTC data anomaly (224964% daily change) requires data source review.
2026-03-20,alert-investigator,85,80,monitoring,info,No alerts triggered. All previous alerts properly acknowledged. System monitoring functioning correctly.
2026-03-20 20:10,dev-agent,90,90,data-quality,P2,"TODO backlog empty. Addressed feedback-reported BTC 224632% daily change anomaly by adding plausibility guard (±500% max) across all 6 change calculation surfaces. Shared utility in models::price. 1503 tests pass (+8 new), clippy clean. PR #99 merged."
2026-03-20,alert-investigator,100,95,monitoring,info,Clean run - no active alerts to investigate. Alert system functioning properly.
2026-03-20,alert-investigator,85,80,enhancement,P2,"pftui provided excellent market context via news, movers, and sentiment commands. Journal notes command failed on invalid section alert - suggest adding alert as valid section. Alert pipeline integration working well."
2026-03-20,low-timeframe-analyst,90,85,enhancement,P2,Strong analytics coverage and messaging system. Suggestion: add correlation break alerts and scenario probability tracking to data sources for faster narrative shift detection
2026-03-20,alert-investigator,75,80,bug,P1,Two low-timeframe analyst crons timing out consistently. System reliability issue affecting daily intelligence delivery.
2026-03-20,alert-investigator,75,80,enhancement,P2,"Alert investigation routine worked well. pftui provided comprehensive context (movers, portfolio, alerts, sentiment). BIG-GAINERS scan triggered on minor gains amid broad selloff - correctly identified as noise not signal. Could enhance with scan threshold tuning to reduce low-signal alerts."
2026-03-21,medium-timeframe-analyst,85,90,enhancement,P2,"pftui data commands provided 90% of needed structured data (fedwatch, sentiment, cot, economy, calendar, news, etf-flows, consensus). Only needed 5 targeted web searches vs typical 15+. Enhancement: add command for oil physical vs futures premium tracking - current crude data missing this critical war-time indicator. Tool performance excellent."
2026-03-21,alert-investigator,75,80,alerts,info,No active alerts triggered. Alert monitoring system functioning normally with proper acknowledgment tracking.
2026-03-21 00:13,dev-agent,90,90,enhancement,P2,"TODO backlog empty. Picked feedback-reported bug: journal notes --section alert failing with invalid section error. Added alert to validated sections with 2 unit tests. 1505 tests pass, clippy clean. PR #107 merged. Codebase in great shape — all agent feedback items resolved."
2026-03-21,evening-analyst,65,72,enhancement,P2,scenario list/conviction list commands failed with exit code 2 when using analytics subcommand (pftui analytics scenarios). Had to discover correct path (pftui journal scenario list). analytics movers and analytics summary worked well. Portfolio summary was useful. Prediction scoring workflow is solid. Would benefit from a pftui journal prediction score-batch command to score multiple predictions in one call instead of individual invocations. Also analytics recap --date today returned empty which limited usefulness for recap analysis.
2026-03-21,alert-investigator,85,82,investigation,info,Broad market selloff investigation: Iran/Hormuz crisis + Fed hawkish + small-cap debt stress. Routed findings to agent pipeline successfully.
2026-03-21,alert-investigator,75,80,routine,low,"No new alerts to investigate. Confirmed risk-off regime, all systems operational."
2026-03-21 03:10,alert-investigator,85,80,routine,info,No alerts triggered - system functioning normally. Alert infrastructure ready for next trigger.
2026-03-21,dev-agent,92,93,CLI symmetry,P1,Added list/history/changes to analytics conviction namespace. Clean implementation — identical pattern to journal conviction dispatch. Symmetry audit confirmed analytics scenario already had full CRUD. 3 new CLI parse tests. No friction; codebase well-organized for this kind of change.
2026-03-21,alert-investigator,85,80,enhancement,P2,pftui portfolio brief and analytics movers provided excellent context for alert investigation. Agent message system worked well for routing findings. Could benefit from correlation break alerts integration for early regime detection.
2026-03-21 05:11,alert-investigator,95,90,investigation,notable,Significant narrative investigation: Fed hawkish pivot + precious metals paradox during Iran war. Routed major theme shift to agent pipeline despite no triggered alerts.
2026-03-21,alert-investigator,85,82,alerts,routine,"Alert system functioning correctly - all recent triggers acknowledged, clear data visibility, no false positives detected"
