date,reviewer,usefulness_pct,overall_pct,category,severity,description
2026-03-24,alert-investigator,85,80,monitoring,low,No unacknowledged alerts found during routine run. All recent alerts (BIG-GAINERS scan changes) were properly acknowledged. Alert system appears to be functioning normally with appropriate noise filtering.
</content>
</invoke>2026-03-24,alert-investigator,85,82,enhancement,P2,Alert investigation workflow effective. pftui alerts ack command worked perfectly. Agent messaging system seamless. Could enhance with alert history/context command to see what triggered specific scans.
2026-03-24,alert-investigator,75,75,routine,normal,No alerts to investigate. All recent alerts already acknowledged. System functioning normally.
2026-03-24,morning-brief,85,88,enhancement,P2,Portfolio brief and analytics data excellent. Scenario tracking and agent messages very useful. Would benefit from more streamlined alignment summary format.
2026-03-24,dev-agent,92,94,feature,P2,"Added portfolio unrealized command (#277). Clean implementation following daily-pnl pattern. All 1621 tests pass, clippy clean. Worktree workflow smooth. No friction."
2026-03-24 16:15:55 UTC,alert-investigator,85,80,alert-management,info,No active alerts to investigate. All alerts properly acknowledged. System functioning normally.
2026-03-24,alert-investigator,88,85,alert-analysis,normal,"BIG-LOSERS scan alert detected meaningful uranium recovery (+4.65% U-U.TO, +4.54% SRUUF) amid geopolitical tensions. Alert system correctly flagged sector divergence as hard assets showed mixed signals (uranium up, gold oversold RSI 29.3). Good signal for potential regime change monitoring."
2026-03-24,alert-investigator,85,82,data_quality,minor,"Portfolio brief and analytics excellent, but economic indicators showed questionable PMI values (2.5 instead of ~50 range). Alert system working well for market moves investigation."
2026-03-24,alert-investigator,85,80,investigation,normal,"Successfully investigated big-losers scan oscillation. Clear catalysts identified (CRCL regulatory, Iran war). Good context provided for agent pipeline."
2026-03-24,dev-agent,90,92,feature,minor,Shipped analytics correlations --json flag and list subcommand (PR #283). Clean implementation — CLI architecture well-structured for adding subcommands and flags. 3 new tests. No friction. Minor note: clap Option<subcommand> + sibling flags pattern works but is slightly unusual.
2026-03-24,alert-investigator,85,80,alert,normal,Investigated big-losers scan alerts. Clear regulatory catalyst identified (stablecoin yield ban). Properly routed to agent pipeline. System working as intended.
2026-03-24,alert-investigator,80,82,enhancement,P2,"Alert system functioning well. All alerts properly acknowledged, no new triggers found. Analytics alerts check command provided clear status overview."
2026-03-24,low-timeframe-analyst,85,80,enhancement,P2,"pftui analytics provided excellent comprehensive market data - situation, deltas, movers, correlations all valuable for EOD analysis. Would benefit from integrated news sentiment scoring and correlation break alerts within the analytics suite rather than separate commands."
2026-03-24,alert-investigator,85,80,monitoring,low,"No active alerts to investigate. Alert system functioning properly with armed price alerts for key levels (BTC 50k/55k/80k, gold 5500, silver 100, etc). Recent activity mostly scan noise (big-gainers/big-losers oscillating)."
2026-03-24,alert-investigator,85,80,alerts,normal,Scan alerts accurately captured brief market momentum from Iran diplomatic news. Alert timing aligned well with news catalyst. System provided good context through movers/news integration.
2026-03-25,medium-timeframe-analyst,85,80,enhancement,P2,COT extreme detection was critical for repositioning calls. FedWatch shift from cuts to holds was key insight. Request: add regime transition alerts when scenario probabilities shift >10% in single session
2026-03-25,dev-agent,92,94,enhancement,P2,Shipped correlation breaks in situation room (PR #291). Clean workflow: existing compute_breaks_backend made integration straightforward. build_snapshot signature change propagated cleanly across 3 call sites. 1626 tests pass (+2 new). Codebase well-structured for this kind of cross-module feature addition.
2026-03-25,alert-investigator,85,80,investigation,normal,Alert system caught uranium gains effectively. Iran negotiation news context from data feeds was comprehensive. Scenario probability tracking needs update mechanism.
2026-03-25,evening-analyst,78,75,enhancement,P2,analytics situation and analytics narrative commands provided excellent structured synthesis for evening analysis. analytics deltas was particularly valuable for tracking 24h conviction and scenario changes. Enhancement request: analytics predictions command returned empty output despite predictions existing in the journal - would benefit from a working prediction summary aggregation. Also analytics situation list returned empty - unclear expected behavior.
2026-03-25,alert-investigator,85,82,monitoring,normal,"No new triggered alerts but identified key Iran peace talk developments driving oil retreat (-1.32%) and risk-on sentiment. Portfolio impact analysis: U-U.TO +4.27% offsetting metals weakness. Flagged XLE extreme overbought (82.1 RSI) at 52-week high. Scenario probabilities: 90% Inflation Spike, 85% Hard Recession (stagflation). Strong cross-system analytics integration."
2026-03-25,alert-investigator,85,80,performance,low,"Alert investigation routine executed successfully. Portfolio brief provided comprehensive context, analytics commands gave good market overview, news data current and relevant. No active alerts detected, system performed health check as expected. Command structure intuitive and data format consistent."
2026-03-25,alert-investigator,85,85,enhancement,P2,"pftui analytics commands worked well for alert investigation. portfolio brief, alerts list, and agent messaging all functioned properly. No major issues."
2026-03-25,dev-agent,92,94,discoverability,P1,Shipped analytics predictions alias and situation list --json guidance (#300). Both P1 items completed in one PR. Codebase well-structured — adding a CLI alias is straightforward with the existing AnalyticsCommand enum pattern. The dispatch in main.rs has many positional parameters which makes adding new routes slightly verbose but clear. 1628 tests passing.
2026-03-25,alert-investigator,85,80,monitoring,info,No unacknowledged alerts. All scan-based alerts properly cycling with market noise. System healthy.
2026-03-25,alert-investigator,95,95,routine,info,"Clean alert investigation run - no triggered alerts found, system operating normally"
2026-03-25,alert-investigator,85,90,operations,info,"No active alerts. System healthy. Market data current, all alerts properly acknowledged."
2026-03-25,alert-investigator,85,80,monitoring,normal,No alerts triggered - routine monitoring. Good data synthesis of geopolitical tensions and market regime. Clear scenario probability updates and appropriate agent routing.
2026-03-25,alert-investigator,90,90,routine,normal,No unacknowledged alerts found during routine health check. All monitoring systems operational and alerts properly armed. Agent messaging pipeline functioning correctly.
2026-03-25,alert-investigator,85,80,narrative-detection,normal,No alerts fired but detected peace dividend narrative shift. System correctly identified Iran peace talks catalyst and JPM bullish outlook. Portfolio tracking accurate.
2026-03-25,pftui-dev-agent,85,90,feature,P2,Added --recent and --recent-hours flags to analytics alerts list for investigation continuity across agent cycles. Includes SQLite+PG support and 6 new tests. PR #309.
2026-03-25,low-timeframe-analyst,90,85,enhancement,P2,"pftui analytics situation provided critical correlation breaks insight (+0.93 DXY-Gold divergence). Agent messages from evening analyst were invaluable for context. Data refresh worked flawlessly. Enhancement needed: ratio-based alerts for Dixon framework (gold/oil ratio, defense vs S&P relative performance). Web search only used for defense sector data (1 query)."
2026-03-25 11:11:02,alert-investigator,85,82,data_quality,info,"Alert investigation routine - all data sources responsive. Portfolio brief, movers, news, alerts, regime data all functioned well. No system issues detected."
2026-03-25,pftui-dev-agent,92,94,feature,medium,Shipped P2: scenario probability shift alerts (#314). New AlertKind::Scenario auto-fires when probability shifts >=10pp. Both SQLite+PG paths. 4 new tests (1638 total). Clippy clean. Also fixed 3 pre-existing clippy warnings. Codebase patterns well-documented and easy to follow.
2026-03-25,alert-investigator,85,80,enhancement,P2,"Alert system missed gold threshold breach (564 vs 800). Portfolio brief, movers, and news data very useful for investigation. Alert routing to agents worked well. Suggest reviewing alert trigger logic."
2026-03-25,alert-investigator,85,82,data-quality,low,Comprehensive portfolio tracking and alert system. Good technical analysis integration. Alert system functioning properly with no false positives today.
2026-03-25,pftui-dev-agent,92,94,feature,P2,Shipped P2: system market-hours command (#318). New MarketPhase enum with 5 phases (Weekend/PreMarket/Regular/AfterHours/Overnight) + agent hints per phase. DST-aware ET conversion. No DB dependency - intercepted before init. 13 new tests (1651 total). Clippy clean. Clean codebase pattern: early-intercept in main.rs for DB-free commands is well-established.
2026-03-25,alert-investigator,88,85,monitoring,normal,"No alerts fired. Space sector rally detected (LUNR +19%, RKLB +11%). VIX 25.97 confirms risk-off regime. All alert thresholds being properly monitored. pftui data quality excellent."
2026-03-25,alert-investigator,85,80,monitoring,normal,Alert system functioning normally. No triggered alerts to investigate. Armed alerts properly configured for key thresholds.
2026-03-25,alert-investigator,75,78,monitoring,normal,No unacked alerts found during 18:28 UTC run. All monitoring systems functioning normally. Armed alerts properly configured and waiting for market conditions. Agent messaging pipeline working correctly.
2026-03-25,alert-investigator,85,82,routine-check,normal,No alerts triggered - successful health check. System monitoring thresholds intact. Iran diplomatic whiplash noted in market context.
2026-03-25,alert-investigator,85,80,alert-detection,normal,BTC alert correctly triggered on 5.53% gain. Investigation revealed Iran diplomatic whiplash as catalyst. Good portfolio impact analysis and agent routing.
2026-03-25,alert-investigator,85,82,operations,low,"Alert system functioning well - no unack alerts, clean acknowledgment tracking, stable data structure. No issues detected."
2026-03-25,low-timeframe-analyst,95,90,enhancement,P2,All core analytics commands performed excellently. Potential enhancement: cross-reference between correlation breaks and impact analysis for faster synthesis.
2026-03-25,pftui-dev-agent,92,94,feature,P3,Shipped F54: Dixon Power Flow Tracker (PR #327). New analytics power-flow add/list/balance commands. power_flows table with SQLite+PG support. Balance accounts for direct and inverse flows. 8 new tests (1659 total). Clippy clean. Only remaining TODO item - all P0/P1/P2/P3 complete.
2026-03-25,alert-investigator,75,80,enhancement,P2,Alert investigation routine worked well. pftui analytics movers provided clear market signals. Agent messaging system functioned correctly. Consider adding alert correlation analysis to detect sector-wide themes automatically.
2026-03-25,alert-investigator,75,80,routine,normal,No alerts triggered. Successfully identified space/tech rally with clear market context. Efficient run.
2026-03-26,pftui-dev-agent,92,94,feature,P2,Shipped ratio-based alerts (AlertKind::Ratio) for cross-asset analysis (PR #332). Natural-language syntax: GC=F/CL=F above 30. Both compact and spaced slash parsing. Engine evaluates from cached prices with graceful missing-symbol handling. 9 new tests (1668 total). Clippy clean. All CI green. Codebase alert patterns well-established - adding a new AlertKind is straightforward.
2026-03-26,evening-analyst,65,68,enhancement,P2,analytics situation/synthesis/summary/deltas provided solid structured data. data prices --cached-only useful. Missing: scenario list command not intuitive (had to discover analytics scenario subcommand). data predictions stats/unanswered return errors. Economy indicators have low confidence values for key metrics like CPI and fed funds rate. Would benefit from a dedicated overnight-futures endpoint and auto-scored prediction lifecycle.
