date,reviewer,usefulness_pct,overall_pct,category,severity,description
2026-03-24,alert-investigator,85,80,monitoring,low,"No unacknowledged alerts found during routine run. All recent alerts (BIG-GAINERS scan changes) were properly acknowledged. Alert system appears to be functioning normally with appropriate noise filtering."
</content>
</invoke>2026-03-24,alert-investigator,85,82,enhancement,P2,Alert investigation workflow effective. pftui alerts ack command worked perfectly. Agent messaging system seamless. Could enhance with alert history/context command to see what triggered specific scans.
2026-03-24,alert-investigator,75,75,routine,normal,No alerts to investigate. All recent alerts already acknowledged. System functioning normally.
2026-03-24,morning-brief,85,88,enhancement,P2,Portfolio brief and analytics data excellent. Scenario tracking and agent messages very useful. Would benefit from more streamlined alignment summary format.
2026-03-24,dev-agent,92,94,feature,P2,"Added portfolio unrealized command (#277). Clean implementation following daily-pnl pattern. All 1621 tests pass, clippy clean. Worktree workflow smooth. No friction."
2026-03-24 16:15:55 UTC,alert-investigator,85,80,alert-management,info,No active alerts to investigate. All alerts properly acknowledged. System functioning normally.
2026-03-24,alert-investigator,88,85,alert-analysis,normal,"BIG-LOSERS scan alert detected meaningful uranium recovery (+4.65% U-U.TO, +4.54% SRUUF) amid geopolitical tensions. Alert system correctly flagged sector divergence as hard assets showed mixed signals (uranium up, gold oversold RSI 29.3). Good signal for potential regime change monitoring."
2026-03-24,alert-investigator,85,82,data_quality,minor,"Portfolio brief and analytics excellent, but economic indicators showed questionable PMI values (2.5 instead of ~50 range). Alert system working well for market moves investigation."
2026-03-24,alert-investigator,85,80,investigation,normal,"Successfully investigated big-losers scan oscillation. Clear catalysts identified (CRCL regulatory, Iran war). Good context provided for agent pipeline."
2026-03-24,dev-agent,90,92,feature,minor,Shipped analytics correlations --json flag and list subcommand (PR #283). Clean implementation — CLI architecture well-structured for adding subcommands and flags. 3 new tests. No friction. Minor note: clap Option<subcommand> + sibling flags pattern works but is slightly unusual.
2026-03-24,alert-investigator,85,80,alert,normal,Investigated big-losers scan alerts. Clear regulatory catalyst identified (stablecoin yield ban). Properly routed to agent pipeline. System working as intended.
2026-03-24,alert-investigator,80,82,enhancement,P2,"Alert system functioning well. All alerts properly acknowledged, no new triggers found. Analytics alerts check command provided clear status overview."
2026-03-24,low-timeframe-analyst,85,80,enhancement,P2,"pftui analytics provided excellent comprehensive market data - situation, deltas, movers, correlations all valuable for EOD analysis. Would benefit from integrated news sentiment scoring and correlation break alerts within the analytics suite rather than separate commands."
2026-03-24,alert-investigator,85,80,monitoring,low,"No active alerts to investigate. Alert system functioning properly with armed price alerts for key levels (BTC 50k/55k/80k, gold 5500, silver 100, etc). Recent activity mostly scan noise (big-gainers/big-losers oscillating)."
2026-03-24,alert-investigator,85,80,alerts,normal,Scan alerts accurately captured brief market momentum from Iran diplomatic news. Alert timing aligned well with news catalyst. System provided good context through movers/news integration.
2026-03-25,medium-timeframe-analyst,85,80,enhancement,P2,COT extreme detection was critical for repositioning calls. FedWatch shift from cuts to holds was key insight. Request: add regime transition alerts when scenario probabilities shift >10% in single session
2026-03-25,dev-agent,92,94,enhancement,P2,Shipped correlation breaks in situation room (PR #291). Clean workflow: existing compute_breaks_backend made integration straightforward. build_snapshot signature change propagated cleanly across 3 call sites. 1626 tests pass (+2 new). Codebase well-structured for this kind of cross-module feature addition.
